Item Title,Publication Title,Book Series Title,Journal Volume,Journal Issue,Item DOI,Authors,Publication Year,URL,Content Type
"A semantic ontology infused deep learning model for disaster tweet classification","Multimedia Tools and Applications","","83","22","10.1007/s11042-023-16840-6","Karnati Sai Venkata GiriGerard Deepak","2024","http://link.springer.com/article/10.1007/s11042-023-16840-6","Article"
"Cognitive differences in product shape evaluation between real settings and virtual reality: case study of two-wheel electric vehicles","Virtual Reality","","28","3","10.1007/s10055-024-01034-8","Zhengjie DuanJiajun ZhouFangzhou Gu","2024","http://link.springer.com/article/10.1007/s10055-024-01034-8","Article"
"Deep learning-based collaborative filtering recommender systems: a comprehensive and systematic review","Neural Computing and Applications","","35","35","10.1007/s00521-023-08958-3","Atena TorkashvandSeyed Mahdi JameiiAkram Reza","2023","http://link.springer.com/article/10.1007/s00521-023-08958-3","Article"
"A review of platforms for simulating embodied agents in 3D virtual environments","Artificial Intelligence Review","","56","4","10.1007/s10462-022-10253-x","Deepti Prit KaurNarinder Pal SinghBonny Banerjee","2023","http://link.springer.com/article/10.1007/s10462-022-10253-x","Article"
"Defense against adversarial attacks via textual embeddings based on semantic associative field","Neural Computing and Applications","","36","1","10.1007/s00521-023-08946-7","Jiacheng HuangLong Chen","2024","http://link.springer.com/article/10.1007/s00521-023-08946-7","Article"
"Light-Deeplabv3+: a lightweight real-time semantic segmentation method for complex environment perception","Journal of Real-Time Image Processing","","21","1","10.1007/s11554-023-01380-x","Peng DingHuaming Qian","2023","http://link.springer.com/article/10.1007/s11554-023-01380-x","Article"
"Toward Human-centered XAI in Practice: A survey","Machine Intelligence Research","","21","4","10.1007/s11633-022-1407-3","Xiangwei KongShujie LiuLuhao Zhu","2024","http://link.springer.com/article/10.1007/s11633-022-1407-3","Article"
"A systematic review of integrated information theory: a perspective from artificial intelligence and the cognitive sciences","Neural Computing and Applications","","","","10.1007/s00521-023-08328-z","Luz Enith GuerreroLuis Fernando CastilloJeferson Arango-LópezFernando Moreira","2023","http://link.springer.com/article/10.1007/s00521-023-08328-z","Article"
"A combined approach for improving humanoid robots autonomous cognitive capabilities","Knowledge and Information Systems","","65","8","10.1007/s10115-023-01844-3","Kurosh MadaniAntonio M. RinaldiCristiano RussoCristian Tommasino","2023","http://link.springer.com/article/10.1007/s10115-023-01844-3","Article"
"Trustworthy artificial intelligence in Alzheimer’s disease: state of the art, opportunities, and challenges","Artificial Intelligence Review","","56","10","10.1007/s10462-023-10415-5","Shaker El-SappaghJose M. Alonso-MoralTamer AbuhmedFarman AliAlberto Bugarín-Diz","2023","http://link.springer.com/article/10.1007/s10462-023-10415-5","Article"
"Dual BiGRU-CNN-based sentiment classification method combining global and local attention","The Journal of Supercomputing","","80","2","10.1007/s11227-023-05558-9","Youwei WangLizhou FengAo LiuWeiqi WangYudong Hou","2024","http://link.springer.com/article/10.1007/s11227-023-05558-9","Article"
"A Review of Key Technologies for Emotion Analysis Using Multimodal Information","Cognitive Computation","","16","4","10.1007/s12559-024-10287-z","Xianxun ZhuChaopeng GuoHeyang FengYao HuangYichen FengXiangyang WangRui Wang","2024","http://link.springer.com/article/10.1007/s12559-024-10287-z","Article"
"Handling noisy labels via one-step abductive multi-target learning and its application to helicobacter pylori segmentation","Multimedia Tools and Applications","","83","24","10.1007/s11042-023-17743-2","Yongquan YangYiming YangJie ChenJiayi ZhengZhongxi Zheng","2024","http://link.springer.com/article/10.1007/s11042-023-17743-2","Article"
"Cross-status communication and project outcomes in OSS development","Empirical Software Engineering","","28","3","10.1007/s10664-023-10298-8","Yisi HanZhendong WangYang FengZhihong ZhaoYi Wang","2023","http://link.springer.com/article/10.1007/s10664-023-10298-8","Article"
"Mediating effects of NLP-based parameters on the readability of crowdsourced wikipedia articles","Applied Intelligence","","54","5","10.1007/s10489-024-05399-w","Simran SetiaAnamika ChhabraAmit Arjun VermaAkrati Saxena","2024","http://link.springer.com/article/10.1007/s10489-024-05399-w","Article"
"Environment awareness, multimodal interaction, and intelligent assistance in industrial augmented reality solutions with deep learning","Multimedia Tools and Applications","","83","16","10.1007/s11042-023-17516-x","Juan Izquierdo-DomenechJordi Linares-PellicerIsabel Ferri-Molla","2024","http://link.springer.com/article/10.1007/s11042-023-17516-x","Article"
"Brain Activity is Influenced by How High Dimensional Data are Represented: An EEG Study of Scatterplot Diagnostic (Scagnostics) Measures","Journal of Healthcare Informatics Research","","8","1","10.1007/s41666-023-00145-2","Ronak EtemadpourSonali ShintreeA. Duke Shereen","2024","http://link.springer.com/article/10.1007/s41666-023-00145-2","Article"
"Blind Multimodal Quality Assessment of Low-Light Images","International Journal of Computer Vision","","","","10.1007/s11263-024-02239-9","Miaohui WangZhuowei XuMai XuWeisi Lin","2024","http://link.springer.com/article/10.1007/s11263-024-02239-9","Article"
"The application of neural network for software vulnerability detection: a review","Neural Computing and Applications","","35","2","10.1007/s00521-022-08046-y","Yuhui ZhuGuanjun LinLipeng SongJun Zhang","2023","http://link.springer.com/article/10.1007/s00521-022-08046-y","Article"
"Open Set Recognition in Real World","International Journal of Computer Vision","","132","8","10.1007/s11263-024-02015-9","Zhen YangJun YuePedram GhamisiShiliang ZhangJiayi MaLeyuan Fang","2024","http://link.springer.com/article/10.1007/s11263-024-02015-9","Article"
"RETRACTED ARTICLE: Memory-guided visual attention generative adversarial network for colorization of nighttime thermal infrared images","Multimedia Tools and Applications","","83","6","10.1007/s11042-023-17030-0","B. MaheswariS. R. Reeja","2024","http://link.springer.com/article/10.1007/s11042-023-17030-0","Article"
"Diagnostic Potential of Eye Movements in Alzheimer’s Disease via a Multiclass Machine Learning Model","Cognitive Computation","","16","6","10.1007/s12559-024-10346-5","Jiaqi SongHaodong HuangJiarui LiuJiani WuYingxi ChenLisong WangFuxin ZhongXiaoqin WangZihan LinMengyu YanWenbo ZhangXintong LiuXinyi TangYang LüWeihua Yu","2024","http://link.springer.com/article/10.1007/s12559-024-10346-5","Article"
"Explainable cognitive decline detection in free dialogues with a Machine Learning approach based on pre-trained Large Language Models","Applied Intelligence","","54","24","10.1007/s10489-024-05808-0","Francisco de Arriba-PérezSilvia García-MéndezJavier Otero-MosqueraFrancisco J. González-Castaño","2024","http://link.springer.com/article/10.1007/s10489-024-05808-0","Article"
"Top-k approximate selection for typicality query results over spatio-textual data","Knowledge and Information Systems","","66","2","10.1007/s10115-023-02013-2","Xiangfu MengXiaoyan ZhangHongjin HuoQiangkui Leng","2024","http://link.springer.com/article/10.1007/s10115-023-02013-2","Article"
"ROS package search for robot software development: a knowledge graph-based approach","Frontiers of Computer Science","","19","6","10.1007/s11704-024-3660-9","Shuo WangXinjun MaoShuo YangMenghan WuZhang Zhang","2024","http://link.springer.com/article/10.1007/s11704-024-3660-9","Article"
"The role of large language models in agriculture: harvesting the future with LLM intelligence","Progress in Artificial Intelligence","","","","10.1007/s13748-024-00359-4","Tawseef Ayoub ShaikhTabasum RasoolK. VeningstonSyed Mufassir Yaseen","2024","http://link.springer.com/article/10.1007/s13748-024-00359-4","Article"
"A novel solution for the development of a sentimental analysis chatbot integrating ChatGPT","Personal and Ubiquitous Computing","","28","6","10.1007/s00779-024-01824-6","Filippo FlorindiPasquale FedeleGiovanna Maria Dimitri","2024","http://link.springer.com/article/10.1007/s00779-024-01824-6","Article"
"A novel attribute reduction method based on intuitionistic fuzzy three-way cognitive clustering","Applied Intelligence","","53","2","10.1007/s10489-022-03496-2","Xian-wei XinChun-lei ShiJing-bo SunZhan-ao XueJi-hua SongWei-ming Peng","2023","http://link.springer.com/article/10.1007/s10489-022-03496-2","Article"
"Lunar ground segmentation using a modified U-net neural network","Machine Vision and Applications","","35","3","10.1007/s00138-024-01533-3","Georgios PetrakisPanagiotis Partsinevelos","2024","http://link.springer.com/article/10.1007/s00138-024-01533-3","Article"
"Application of artificial intelligence technology in the field of orthopedics: a narrative review","Artificial Intelligence Review","","57","1","10.1007/s10462-023-10638-6","Pengran LiuJiayao ZhangSongxiang LiuTongtong HuoJiajun HeMingdi XueYing FangHonglin WangYi XieMao XieDan ZhangZhewei Ye","2024","http://link.springer.com/article/10.1007/s10462-023-10638-6","Article"
"An efficient resume skill extraction using deep feature-based AGT optimized K means clustering","Multimedia Tools and Applications","","83","25","10.1007/s11042-024-18220-0","J. Himabindu PriyankaNikhat Parveen","2024","http://link.springer.com/article/10.1007/s11042-024-18220-0","Article"
"A brief survey on recent advances in coreference resolution","Artificial Intelligence Review","","56","12","10.1007/s10462-023-10506-3","Ruicheng LiuRui MaoAnh Tuan LuuErik Cambria","2023","http://link.springer.com/article/10.1007/s10462-023-10506-3","Article"
"Emotion spreading carried by emoji in social network","Social Network Analysis and Mining","","13","1","10.1007/s13278-023-01144-2","Fuzhong NianXiaochen YangZheming Wang","2023","http://link.springer.com/article/10.1007/s13278-023-01144-2","Article"
"A survey on large language model based autonomous agents","Frontiers of Computer Science","","18","6","10.1007/s11704-024-40231-1","Lei WangChen MaXueyang FengZeyu ZhangHao YangJingsen ZhangZhiyuan ChenJiakai TangXu ChenYankai LinWayne Xin ZhaoZhewei WeiJirong Wen","2024","http://link.springer.com/article/10.1007/s11704-024-40231-1","Article"
"Attention-based efficient robot grasp detection network","Frontiers of Information Technology & Electronic Engineering","","24","10","10.1631/FITEE.2200502","Xiaofei Qin 秦晓飞Wenkai Hu 胡文凯Chen Xiao 肖晨Changxiang He 何常香Songwen Pei 裴颂文Xuedian Zhang 张学典","2023","http://link.springer.com/article/10.1631/FITEE.2200502","Article"
"Analyzing 40 years of educational technology trends: insights from advanced text mining and machine learning","Multimedia Tools and Applications","","","","10.1007/s11042-024-20294-9","Fatih Gurcan","2024","http://link.springer.com/article/10.1007/s11042-024-20294-9","Article"
"Cognitive motivations and foundations for building intelligent decision-making systems","Artificial Intelligence Review","","56","4","10.1007/s10462-022-10255-9","Zdzisław KowalczukMichał Czubenko","2023","http://link.springer.com/article/10.1007/s10462-022-10255-9","Article"
"Lexeme connexion measure of cohesive lexical ambiguity revealing factor: a robust approach for word sense disambiguation of Bengali text","Multimedia Tools and Applications","","83","5","10.1007/s11042-023-14676-8","Debapratim Das DawnAbhinandan KhanSoharab Hossain ShaikhRajat Kumar Pal","2024","http://link.springer.com/article/10.1007/s11042-023-14676-8","Article"
"Research on the influence mechanism of key halo effect and Matthew effect on product online word-of-mouth: considering the moderating role of online store service quality","Multimedia Tools and Applications","","83","5","10.1007/s11042-023-16124-z","Shugang LiYanfang WeiZhaoxu Yu","2024","http://link.springer.com/article/10.1007/s11042-023-16124-z","Article"
"DeepThink IoT: The Strength of Deep Learning in Internet of Things","Artificial Intelligence Review","","56","12","10.1007/s10462-023-10513-4","Divyansh ThakurJaspal Kaur SainiSrikant Srinivasan","2023","http://link.springer.com/article/10.1007/s10462-023-10513-4","Article"
"Emotion quantification techniques for cognitive reappraisal: a systematic review and scientometric analysis","Artificial Intelligence Review","","56","3","10.1007/s10462-023-10606-0","Mir Aamir HamidJaiteg Singh","2023","http://link.springer.com/article/10.1007/s10462-023-10606-0","Article"
"SAPFIS: a parallel fuzzy inference system for air combat situation assessment","The Journal of Supercomputing","","81","1","10.1007/s11227-024-06521-y","Lei GaoJingfei JiangJinwei XuWeijia WangPengbo Wu","2024","http://link.springer.com/article/10.1007/s11227-024-06521-y","Article"
"Project-first approach to programming in K–12: Tracking the development of novice programmers in technology-deprived environments","Education and Information Technologies","","28","1","10.1007/s10639-022-11180-8","Ndudi O. Ezeamuzie","2023","http://link.springer.com/article/10.1007/s10639-022-11180-8","Article"
"Pull-the-strings","Multimedia Tools and Applications","","83","15","10.1007/s11042-021-11876-y","Luis Leite","2024","http://link.springer.com/article/10.1007/s11042-021-11876-y","Article"
"An optimized deep focused U-Net model for image segmentation","Neural Computing and Applications","","","","10.1007/s00521-024-10417-6","Haroon Haider KhanMajid Iqbal Khan","2024","http://link.springer.com/article/10.1007/s00521-024-10417-6","Article"
"Short-Answer Grading for German: Addressing the Challenges","International Journal of Artificial Intelligence in Education","","34","4","10.1007/s40593-023-00383-w","Ulrike PadóYunus EryilmazLarissa Kirschner","2024","http://link.springer.com/article/10.1007/s40593-023-00383-w","Article"
"Multi-resolution Twinned Residual Auto-Encoders (MR-TRAE)—A Novel DL Model for Image Multi-resolution","Cognitive Computation","","16","4","10.1007/s12559-024-10293-1","Alireza MomenzadehEnzo BaccarelliMichele ScarpinitiSima Sarv Ahrabi","2024","http://link.springer.com/article/10.1007/s12559-024-10293-1","Article"
"From Pixels to Prepositions: Linking Visual Perception with Spatial Prepositions Far and Near","Cognitive Computation","","16","6","10.1007/s12559-024-10329-6","Krishna Raj S RSrinivasa Chakravarthy VAnindita Sahoo","2024","http://link.springer.com/article/10.1007/s12559-024-10329-6","Article"
"Transitioning to Online Instructions and COVID-19 Response: A View from Mining Emergent College Students Discourse in Online Discussion Forum","International Journal of Artificial Intelligence in Education","","34","3","10.1007/s40593-024-00411-3","Yiwen LinNia Nixon","2024","http://link.springer.com/article/10.1007/s40593-024-00411-3","Article"
"Near-term advances in quantum natural language processing","Annals of Mathematics and Artificial Intelligence","","92","5","10.1007/s10472-024-09940-y","Dominic WiddowsAaranya AlexanderDaiwei ZhuChase ZimmermanArunava Majumder","2024","http://link.springer.com/article/10.1007/s10472-024-09940-y","Article"
"Using machine learning to predict artistic styles: an analysis of trends and the research agenda","Artificial Intelligence Review","","57","5","10.1007/s10462-024-10727-0","Jackeline ValenciaGeraldine García PinedaVanessa García PinedaAlejandro Valencia-AriasJuan Arcila-DiazRenata Teodori de la Puente","2024","http://link.springer.com/article/10.1007/s10462-024-10727-0","Article"
"Predicting product advertisement links using hybrid learning within social networks","The Journal of Supercomputing","","79","13","10.1007/s11227-023-05213-3","Seyed Mohsen Ebadi JokandanPeyman BayatMehdi Farrokhbakht Foumani","2023","http://link.springer.com/article/10.1007/s11227-023-05213-3","Article"
"Mapping digital literacy in language education: A comparative analysis of national curriculum standards using text as data approach","Education and Information Technologies","","","","10.1007/s10639-024-13056-5","Deul RohJiseung YooHyounjin Ok","2024","http://link.springer.com/article/10.1007/s10639-024-13056-5","Article"
"Exploring contributors, collaborations, and research topics in educational technology: A joint analysis of mainstream conferences","Education and Information Technologies","","28","2","10.1007/s10639-022-11209-y","Xieling ChenDi ZouHaoran XieGuanliang ChenJionghao LinGary Cheng","2023","http://link.springer.com/article/10.1007/s10639-022-11209-y","Article"
"Presence and consequences of positive words in scientific abstracts","Scientometrics","","128","12","10.1007/s11192-023-04864-6","Moritz EdlingerFinn BuchrieserGuilherme Wood","2023","http://link.springer.com/article/10.1007/s11192-023-04864-6","Article"
"Galactica’s dis-assemblage: Meta’s beta and the omega of post-human science","AI & SOCIETY","","","","10.1007/s00146-024-02088-7","Nicolas Chartier-EdwardsEtienne GrenierValentin Goujon","2024","http://link.springer.com/article/10.1007/s00146-024-02088-7","Article"
"EmoDNN: understanding emotions from short texts through a deep neural network ensemble","Neural Computing and Applications","","35","18","10.1007/s00521-023-08435-x","Sara KamranRaziyeh ZallSaeid HosseiniMohammadReza KangavariSana RahmaniWen Hua","2023","http://link.springer.com/article/10.1007/s00521-023-08435-x","Article"
"Style matching CAPTCHA: match neural transferred styles to thwart intelligent attacks","Multimedia Systems","","29","4","10.1007/s00530-023-01075-0","Palash RayAsish BeraDebasis GiriDebotosh Bhattacharjee","2023","http://link.springer.com/article/10.1007/s00530-023-01075-0","Article"
"Reverse-engineering information presentations: recovering hierarchical grouping from layouts of visual elements","Visual Intelligence","","1","1","10.1007/s44267-023-00010-1","Danqing ShiWeiwei CuiDanqing HuangHaidong ZhangNan Cao","2023","http://link.springer.com/article/10.1007/s44267-023-00010-1","Article"
"A survey of sentiment analysis from film critics based on machine learning, lexicon and hybridization","Neural Computing and Applications","","35","13","10.1007/s00521-023-08359-6","Mustafa Abdalrassual JassimDhafar Hamed AbdMohamed Nazih Omri","2023","http://link.springer.com/article/10.1007/s00521-023-08359-6","Article"
"An academic recommender system on large citation data based on clustering, graph modeling and deep learning","Knowledge and Information Systems","","66","8","10.1007/s10115-024-02094-7","Vaios StergiopoulosMichael VassilakopoulosEleni TousidouAntonio Corral","2024","http://link.springer.com/article/10.1007/s10115-024-02094-7","Article"
"Visualization in virtual reality: a systematic review","Virtual Reality","","27","2","10.1007/s10055-023-00753-8","Elif Hilal KorkutElif Surer","2023","http://link.springer.com/article/10.1007/s10055-023-00753-8","Article"
"Two-way Concept-Cognitive Learning with Multi-source Fuzzy Context","Cognitive Computation","","15","5","10.1007/s12559-023-10107-w","Xiaoyan ZhangDoudou GuoWeihua Xu","2023","http://link.springer.com/article/10.1007/s12559-023-10107-w","Article"
"Research on full-cycle sharing method of natural resources big data based on middle platform architecture","Multimedia Tools and Applications","","","","10.1007/s11042-024-20434-1","Qian Li","2024","http://link.springer.com/article/10.1007/s11042-024-20434-1","Article"
"Empowering reciprocal recommender system using contextual bandits and argumentation based explanations","World Wide Web","","26","5","10.1007/s11280-023-01173-z","Tulika KumariBhavna GuptaRavish SharmaPunam Bedi","2023","http://link.springer.com/article/10.1007/s11280-023-01173-z","Article"
"Machine Learning Algorithms for Predicting and Analyzing Arabic Sentiment","SN Computer Science","","5","8","10.1007/s42979-024-03494-w","Amani A. AladeemyTheyazn H.H. AldhyaniAli AlzahraniEidah M. AlzahraniOsamah Ibrahim KhalafSaleh Nagi AlsubariSachin N. DeshmukhMosleh Hmoud Al-Adhaileh","2024","http://link.springer.com/article/10.1007/s42979-024-03494-w","Article"
"An efficient two-state GRU based on feature attention mechanism for sentiment analysis","Multimedia Tools and Applications","","83","1","10.1007/s11042-022-13339-4","Muhammad ZulqarnainRozaida GhazaliMuhammad AamirYana Mazwin Mohmad Hassim","2024","http://link.springer.com/article/10.1007/s11042-022-13339-4","Article"
"Investigating online learners’ knowledge structure patterns by concept maps: A clustering analysis approach","Education and Information Technologies","","28","9","10.1007/s10639-023-11633-8","Xiuling HeJing FangHercy N. H. ChengQibin MenYangyang Li","2023","http://link.springer.com/article/10.1007/s10639-023-11633-8","Article"
"Towards making computers conscious: trends and challenges","Iran Journal of Computer Science","","7","2","10.1007/s42044-023-00164-7","L. M. Patnaik","2024","http://link.springer.com/article/10.1007/s42044-023-00164-7","Article"
"The key artificial intelligence technologies in early childhood education: a review","Artificial Intelligence Review","","57","1","10.1007/s10462-023-10637-7","Honghu YiTing LiuGongjin Lan","2024","http://link.springer.com/article/10.1007/s10462-023-10637-7","Article"
"Brain-inspired filtering Network for small infrared target detection","Multimedia Tools and Applications","","82","18","10.1007/s11042-023-14762-x","Ju MoranHu Qing","2023","http://link.springer.com/article/10.1007/s11042-023-14762-x","Article"
"Abstractive text summarization employing ontology-based knowledge-aware multi-focus conditional generative adversarial network (OKAM-CGAN) with hybrid pre-processing methodology","Multimedia Tools and Applications","","82","15","10.1007/s11042-022-14155-6","Nafees Muneera MSriramya P","2023","http://link.springer.com/article/10.1007/s11042-022-14155-6","Article"
"Distributed Deep Reinforcement Learning: A Survey and a Multi-player Multi-agent Learning Toolbox","Machine Intelligence Research","","21","3","10.1007/s11633-023-1454-4","Qiyue YinTongtong YuShengqi ShenJun YangMeijing ZhaoWancheng NiKaiqi HuangBin LiangLiang Wang","2024","http://link.springer.com/article/10.1007/s11633-023-1454-4","Article"
"Real-time instance segmentation with assembly parallel task","The Visual Computer","","39","9","10.1007/s00371-022-02537-8","Zhen YangYang WangFan YangZhijian YinTao Zhang","2023","http://link.springer.com/article/10.1007/s00371-022-02537-8","Article"
"A review of AI teaching and learning from 2000 to 2020","Education and Information Technologies","","28","7","10.1007/s10639-022-11491-w","Davy Tsz Kit NgMin LeeRoy Jun Yi TanXiao HuJ. Stephen DownieSamuel Kai Wah Chu","2023","http://link.springer.com/article/10.1007/s10639-022-11491-w","Article"
"Citation advantage of positive words: predictability, temporal evolution, and universality in varied quality journals","Scientometrics","","129","7","10.1007/s11192-024-05074-4","Dengsheng WuHuidong WuJianping Li","2024","http://link.springer.com/article/10.1007/s11192-024-05074-4","Article"
"Developing a computer-based tutor utilizing Generative Artificial Intelligence (GAI) and Retrieval-Augmented Generation (RAG)","Education and Information Technologies","","","","10.1007/s10639-024-13129-5","Youngjin Lee","2024","http://link.springer.com/article/10.1007/s10639-024-13129-5","Article"
"Text recognition and analysis of network public opinion focus events of a major epidemic: a case study of “COVID-19” in Sina Microblogs","Multimedia Tools and Applications","","82","17","10.1007/s11042-023-14916-x","HeLin WeiChenying HaiDonglu ShanBei LyuXiulai Wang","2023","http://link.springer.com/article/10.1007/s11042-023-14916-x","Article"
"Graph pooling in graph neural networks: methods and their applications in omics studies","Artificial Intelligence Review","","57","11","10.1007/s10462-024-10918-9","Yan WangWenju HouNan ShengZiqi ZhaoJialin LiuLan HuangJuexin Wang","2024","http://link.springer.com/article/10.1007/s10462-024-10918-9","Article"
"A meta-analysis of the effectiveness of programming teaching in promoting K-12 students’ computational thinking","Education and Information Technologies","","28","6","10.1007/s10639-022-11445-2","Enwei XuWei WangQingxia Wang","2023","http://link.springer.com/article/10.1007/s10639-022-11445-2","Article"
"Enhancing knowledge discovery and management through intelligent computing methods: a decisive investigation","Knowledge and Information Systems","","66","7","10.1007/s10115-024-02099-2","Rayees AhamadKamta Nath Mishra","2024","http://link.springer.com/article/10.1007/s10115-024-02099-2","Article"
"High spatial resolution remote sensing image segmentation based on the multiclassification model and the binary classification model","Neural Computing and Applications","","35","5","10.1007/s00521-020-05561-8","Xiaoxiong ZhengTao Chen","2023","http://link.springer.com/article/10.1007/s00521-020-05561-8","Article"
"emoLearnAdapt: A new approach for an emotion-based adaptation in e-learning environments","Education and Information Technologies","","29","12","10.1007/s10639-023-12429-6","Adil BoughidaMohamed Nadjib KouahlaYacine Lafifi","2024","http://link.springer.com/article/10.1007/s10639-023-12429-6","Article"
"Cognition2Vocation: meta-learning via ConvNets and continuous transformers","Neural Computing and Applications","","36","21","10.1007/s00521-024-09749-0","Sara KamranSaeid HosseiniSayna EsmailzadehMohammad Reza KangavariWen Hua","2024","http://link.springer.com/article/10.1007/s00521-024-09749-0","Article"
