Item Title,Publication Title,Book Series Title,Journal Volume,Journal Issue,Item DOI,Authors,Publication Year,URL,Content Type
"UCEMA: Uni-modal and cross-modal encoding network based on multi-head attention for emotion recognition in conversation","Multimedia Systems","","30","6","10.1007/s00530-024-01561-z","Hongkun ZhaoSiyuan LiuYang ChenFanmin KongQingtian ZengKang Li","2024","http://link.springer.com/article/10.1007/s00530-024-01561-z","Article"
"A Semi-Automated Solution Approach Recommender for a Given Use Case: a Case Study for AI/ML in Oncology via Scopus and OpenAI","Human-Centric Intelligent Systems","","4","3","10.1007/s44230-024-00070-6","Deniz Kenan KılıçAlex Elkjær VasegaardAurélien DesoeuvresPeter Nielsen","2024","http://link.springer.com/article/10.1007/s44230-024-00070-6","Article"
"Enhanced Self-Attention-Based Rapid CNN for Detecting Dense Objects in Varying Illumination","Cognitive Computation","","17","1","10.1007/s12559-024-10376-z","Lu ChenLi YangTan JieMa HaoyuanLiu YuFu ShenbingJunkang WangHao WuGun Li","2024","http://link.springer.com/article/10.1007/s12559-024-10376-z","Article"
"How is public discussion as reflected in WeChat articles different from scholarly research in China? An empirical study of metaverse","Scientometrics","","129","1","10.1007/s11192-023-04892-2","Yang ZhangYinghua XieLongfei LiYian LiangHouqiang Yu","2024","http://link.springer.com/article/10.1007/s11192-023-04892-2","Article"
"Ensemble-of-classifiers-based approach for early Alzheimer’s Disease detection","Multimedia Tools and Applications","","83","6","10.1007/s11042-023-16023-3","RS RajasreeS Brintha Rajakumari","2024","http://link.springer.com/article/10.1007/s11042-023-16023-3","Article"
"Design of inception with deep convolutional neural network based fall detection and classification model","Multimedia Tools and Applications","","83","8","10.1007/s11042-023-16476-6","K. Durga BhavaniM. Ferni Ukrit","2024","http://link.springer.com/article/10.1007/s11042-023-16476-6","Article"
"Enhancing academic performance prediction with temporal graph networks for massive open online courses","Journal of Big Data","","11","1","10.1186/s40537-024-00918-5","Qionghao HuangJili Chen","2024","http://link.springer.com/article/10.1186/s40537-024-00918-5","Article"
"Beyond phase-in: assessing impacts on disinformation of the EU Digital Services Act","AI and Ethics","","","","10.1007/s43681-024-00467-w","Luca NanniniEleonora BonelDavide BassiMichele Joshua Maggini","2024","http://link.springer.com/article/10.1007/s43681-024-00467-w","Article"